<?xml version="1.0" encoding="utf-8"?>
<root xmlns="http://www.homoki.net/uri/customXMLcontracts/" 
xmlns:xsi="http://www.w3.org/2001/XMLSchema-instance" >
<!--xsi:schemaLocation="http://www.homoki.net/uri/customXMLcontracts/ customXMLContracts.xsd"-->
<HotDocsReferences>
<ClientName/>
<ClientAddress/>
<ClientObligatoryMiscInformation/>
<ClientRegisterFullData/>
<ClientRegisterName/>
<ClientRegistrationIdentifier/>
<ClientSignatureDate/>
<ClientSignaturePlace/>
<ClientTaxNumberHun/>
<ClientTaxNumber/>
<PartnerName/>
<PartnerAddress/>
<PartnerObligatoryMiscInformation/>
<PartnerRegisterFullData/>
<PartnerRegisterName/>
<PartnerRegistrationIdentifier/>
<PartnerSignatureDate/>
<PartnerSignaturePlace/>
<PartnerTaxNumber/>
<FeeCurrency/>
<ContractTitle/>
<ContractTitleToModifyName/>
<PartnerRepresentedBy/>
<ClientRepresentedBy/>
<!--<AlperesLevelezesiCime/>
<AlperesNeve/>
<BirosagNeve/>
<EljaroUgyvedNeve/>
<FelperesLevelezesiCime/>
<FelperesNeve/>
<JogiKepviseloNeve/>
<KovetelesErteke/>
<KozigazgatasiHatarozat/>
<PerTargya/>-->
</HotDocsReferences>
<client>
<name/>
<role/>
<address/>
<taxnumber/>
<otherIDdata/>
<contractID/>
<caseOrProcessID/>
<commitmentNature/>
<commitmentEnd/>
<placeOfSignature/>
<dateOfSignature/>
</client>
<clientsPartner>
<name/>
<role/>
<address/>
<taxnumber/>
<otherIDdata/>
<contractID/>
<caseOrProcessID/>
<commitmentNature/>
<commitmentEnd/>
<placeOfSignature/>
<dateOfSignature/>
</clientsPartner>
<thirdParty>
<name/>
<role/>
<address/>
<taxnumber/>
<otherIDdata/>
<contractID/>
<caseOrProcessID/>
<commitmentNature/>
<commitmentEnd/>
<placeOfSignature/>
<dateOfSignature/>
</thirdParty>
<frontPart/>
<bodyPart/>
<backPart/>
<attachmentList/>
<signatureBlock/>
<definitionBlock/>
<contractModified>
<name/>
<lastSignatureDate/>
<effectivityDate/>
<ID/>
</contractModified>
<neutralContractID/>
<term>
<begin/>
<end/>
</term>
<objectofContract>
<name/>
<ID/>
<address/>
<description/>
</objectofContract>
</root>